{"counts":{"acts":1,"app_preferences":1,"bible_events":2,"captures":3,"chapters":2,"character_chapters":1,"character_events":3,"characters":3,"collection_items":2,"collections":2,"custom_entities":1,"custom_entity_types":1,"entity_images":1,"entity_media":3,"entity_tags":2,"experts":1,"figure_relationships":1,"group_members":2,"groups":1,"historical_figures":2,"institutions":1,"location_events":1,"locations":1,"media_objects":3,"mention_links":1,"parts":1,"portfolio_entries":1,"publishers":1,"relationships":1,"submissions":1,"tags":2,"thread_events":1,"threads":1,"works":2},"format":"lyceum-export-manifest","format_version":"1.0","lyceum_json":{"path":"lyceum.json","sha256":"d027f9ac5d0543680e4d0f2bfce528f2d8c51183e64f72bc95f80e901061dea6","size":14664},"media":[{"path":"media/b8/74/b87470ff2b2992c65aa04bcfaba7a0d23d570edfdae0d2f0e91aac247b47c162","sha256":"b87470ff2b2992c65aa04bcfaba7a0d23d570edfdae0d2f0e91aac247b47c162","size":33},{"path":"media/fb/bc/fbbc27238b7127eaa2b0022743a81404ca38ef7935405b388d6ace2e451753cb","sha256":"fbbc27238b7127eaa2b0022743a81404ca38ef7935405b388d6ace2e451753cb","size":44},{"path":"media/fc/89/fc892e954c07bdda3bb015c1220d535adf63d38bfb9f95ee4e52d22ae32cd6b2","sha256":"fc892e954c07bdda3bb015c1220d535adf63d38bfb9f95ee4e52d22ae32cd6b2","size":36}],"missing_media":[],"schema_version":2}
